{
  "schema_version": "1.0.0",
  "record_type": "evidence_appraisal",
  "id": "evidence-appraisal-ssr-scoring-validation-use-method-classification-r1",
  "name": "Method Classification review for ssr-scoring-validation-use bundle",
  "candidate_bundle_id": "ssr-scoring-validation-use-baseline-2026-06-02",
  "bundle_revision_number": 1,
  "appraisal_round": 1,
  "appraisal_lane": "method_classification",
  "appraiser_kind": "agent",
  "appraiser_id": "codex-agent",
  "skill_name": "evidence-appraisal",
  "status": "complete",
  "verdict": "accept",
  "blocking": false,
  "summary": "Accepted. The staged records distinguish framework guidance, demographic synthetic-response fairness probing, CASE corruption training augmentation, and LLM simulated-essay calibration. Generation model and prompt details are captured when reported and marked as unreported when the source does not name a model version.",
  "appraised_change_ids": [
    "create-ssr-scoring-validation-search-protocol",
    "create-frohn-llm-cr-live-scoring-source",
    "create-walsh-sjt-automated-scoring-source",
    "create-yoo-dress-rubric-aes-source",
    "create-wolfe-calibrating-realistic-essays-source",
    "create-frohn-validation-framework-artifact",
    "create-walsh-fairness-stress-test-artifact",
    "create-yoo-dress-training-boundary-artifact",
    "create-wolfe-realistic-essays-artifact",
    "create-frohn-validation-framework-finding",
    "create-walsh-fairness-stress-test-finding",
    "create-yoo-training-boundary-finding",
    "create-wolfe-realistic-essays-finding",
    "create-ssr-scoring-validation-use-claim"
  ],
  "findings": [],
  "created_at": "2026-06-02T12:25:00Z",
  "updated_at": "2026-06-02T12:25:00Z"
}
