{
  "schema_version": "1.0.0",
  "record_type": "evidence_appraisal",
  "id": "evidence-appraisal-ssr-model-choice-student-simulation-validity-update-method-classification-r1",
  "name": "Method Classification review for Model Choice and Student-Simulation Validity Update bundle",
  "candidate_bundle_id": "ssr-model-choice-student-simulation-validity-update-2026-06-03",
  "bundle_revision_number": 1,
  "appraisal_round": 1,
  "appraisal_lane": "method_classification",
  "appraiser_kind": "agent",
  "skill_name": "evidence-appraisal",
  "appraiser_id": "codex-agent",
  "status": "complete",
  "verdict": "accept",
  "blocking": false,
  "summary": "Accepted. Do et al. is classified as prompted simulated-student role play plus post-training experiments; Yuan et al. as a conceptual framework; and Martynova et al. as mixed-method teacher/stakeholder authenticity evidence based on MathDial and interviews. The bundle does not recast post-training results as an implementation plan.",
  "appraised_change_ids": [
    "create-do-source",
    "create-do-artifact",
    "create-do-finding",
    "create-yuan-source",
    "create-yuan-artifact",
    "create-yuan-finding",
    "create-martynova-source",
    "create-martynova-artifact",
    "create-martynova-finding",
    "create-model-choice-search-protocol"
  ],
  "findings": [
    {
      "finding_id": "post-training-classified-as-boundary-evidence",
      "severity": "note",
      "category": "method_misclassification",
      "claim_or_issue": "Do et al.'s SFT/DPO/GRPO results are included as evidence that prompt-only simulation has limits and misconception faithfulness is trainable, not as a recommendation that this project should fine-tune models.",
      "why_it_matters": "The user explicitly excluded first-hand fine-tuning or model-comparison research from the next step.",
      "recommended_action": "Keep the fine-tuning scope caveat in the finding and memo update.",
      "resolution_status": "closed",
      "applies_to_change_id": "create-do-finding"
    }
  ],
  "created_at": "2026-06-03T20:16:00Z",
  "updated_at": "2026-06-03T20:16:00Z"
}
