{
  "schema_version": "1.0.0",
  "record_type": "evidence_appraisal",
  "id": "evidence-appraisal-ssr-operational-practice-policy-update-scorer-validation-relevance-r1",
  "name": "Scorer Validation Relevance review for Operational Practice and Policy Boundary Update bundle",
  "candidate_bundle_id": "ssr-operational-practice-policy-update-2026-06-03",
  "bundle_revision_number": 1,
  "appraisal_round": 1,
  "appraisal_lane": "scorer_validation_relevance",
  "appraiser_kind": "agent",
  "skill_name": "evidence-appraisal",
  "appraiser_id": "codex-agent",
  "status": "complete",
  "verdict": "accept",
  "blocking": false,
  "summary": "Accepted. The staged claims do not use operational QA/test-suite evidence as final scorer-validation evidence. Zhang et al. is relevant to scorer training utility because evaluation remains on held-out real student essays.",
  "appraised_change_ids": [
    "create-new-meridian-source",
    "create-new-meridian-artifact",
    "create-new-meridian-finding",
    "create-maine-source",
    "create-maine-artifact",
    "create-maine-finding",
    "create-zhang-source",
    "create-zhang-artifact",
    "create-zhang-finding",
    "create-operational-practice-search-protocol",
    "update-acceptable-scoring-uses-claim",
    "update-assessment-stakes-boundaries-claim"
  ],
  "findings": [
    {
      "finding_id": "qa-test-suite-evidence-kept-out-of-final-validation",
      "severity": "note",
      "category": "scorer_validation_relevance",
      "claim_or_issue": "New Meridian and Maine support implementation QA for machine-scored output, not final validation of statistical or LLM scoring models.",
      "why_it_matters": "The central risk in this bundle is over-reading operational QA as deployment-readiness evidence.",
      "recommended_action": "Retain the staged does_not_apply_when and limitations that exclude synthetic-only final validation and live scoring claims.",
      "resolution_status": "closed",
      "applies_to_change_id": "update-assessment-stakes-boundaries-claim"
    }
  ],
  "created_at": "2026-06-03T13:22:00Z",
  "updated_at": "2026-06-03T13:22:00Z"
}
