{
  "schema_version": "1.0.0",
  "record_type": "evidence_appraisal",
  "id": "evidence-appraisal-ssr-acceptable-scoring-uses-operational-augmentation-update-scorer-validation-relevance-r1",
  "name": "Scorer Validation Relevance review for Acceptable Use Operational Training Augmentation Update bundle",
  "candidate_bundle_id": "ssr-acceptable-scoring-uses-operational-augmentation-update-2026-06-03",
  "bundle_revision_number": 1,
  "appraisal_round": 1,
  "appraisal_lane": "scorer_validation_relevance",
  "appraiser_kind": "agent",
  "skill_name": "evidence-appraisal",
  "appraiser_id": "codex-agent",
  "status": "complete",
  "verdict": "accept",
  "blocking": false,
  "summary": "Accepted. The claim is relevant to automated-scoring development and validation workflows while preserving the distinction between training augmentation and final validation. It explicitly denies synthetic-only deployment-readiness, subgroup fairness, cut-score, and operational decision support.",
  "appraised_change_ids": [
    "update-acceptable-scoring-uses-claim"
  ],
  "findings": [
    {
      "finding_id": "training-augmentation-not-validation-replacement",
      "severity": "note",
      "category": "validation_boundary",
      "claim_or_issue": "Operational training augmentation can improve model development evidence but is not itself final validation evidence.",
      "why_it_matters": "This is the central distinction needed for automated scoring and public assessment claims.",
      "recommended_action": "Retain the staged interpretive note and does_not_apply_when language.",
      "resolution_status": "closed",
      "applies_to_change_id": "update-acceptable-scoring-uses-claim"
    }
  ],
  "created_at": "2026-06-03T12:06:30Z",
  "updated_at": "2026-06-03T12:06:30Z"
}
