{
  "schema_version": "1.0.0",
  "record_type": "evidence_appraisal",
  "id": "evidence-appraisal-release-provenance-control-source-fidelity-r1",
  "name": "Source Fidelity Review For Release Provenance Control Baseline",
  "candidate_bundle_id": "release-provenance-control-baseline-2026-06-01",
  "bundle_revision_number": 1,
  "appraisal_round": 1,
  "appraisal_lane": "source_fidelity",
  "appraiser_kind": "agent",
  "skill_name": "evidence-appraisal",
  "status": "complete",
  "verdict": "accept",
  "blocking": false,
  "summary": "The staged source, artifact, finding, and claim accurately identify the SLSA Build Provenance v1.2 specification and keep extracted observations tied to the cited specification page.",
  "appraised_change_ids": [
    "create-slsa-provenance-source",
    "create-slsa-provenance-artifact",
    "create-slsa-provenance-finding",
    "create-release-provenance-claim"
  ],
  "findings": [],
  "created_at": "2026-06-01T19:34:00Z",
  "updated_at": "2026-06-01T19:34:00Z"
}
