{
  "schema_version": "1.0.0",
  "record_type": "evidence_appraisal",
  "id": "evidence-appraisal-ssr-validity-conditions-claim-hardening-synthesis-overreach-r1",
  "name": "Synthesis Overreach review for Validity Conditions Claim Hardening Update bundle",
  "candidate_bundle_id": "ssr-validity-conditions-claim-hardening-update-2026-06-03",
  "bundle_revision_number": 1,
  "appraisal_round": 1,
  "appraisal_lane": "synthesis_overreach",
  "appraiser_kind": "agent",
  "skill_name": "evidence-appraisal",
  "appraiser_id": "codex-agent",
  "status": "complete",
  "verdict": "accept",
  "blocking": false,
  "summary": "Accepted. The claim updates make support maps match the literature-review synthesis while retaining medium confidence and explicit task-bound limitations.",
  "appraised_change_ids": [
    "update-quality-evaluation-claim",
    "update-model-generation-effects-claim",
    "update-prompt-engineering-effects-claim",
    "update-real-response-comparison-claim",
    "update-scoring-validation-use-claim",
    "update-acceptable-scoring-uses-claim"
  ],
  "findings": [
    {
      "finding_id": "support-map-hardening-without-confidence-inflation",
      "severity": "note",
      "category": "claim_overreach",
      "claim_or_issue": "The staged claims add support entries and update summaries but do not increase confidence or remove limitations.",
      "why_it_matters": "The evidence is stronger for traceability, but still heterogeneous and not a basis for synthetic-only scorer validation.",
      "recommended_action": "Publish the staged support-map updates as written.",
      "resolution_status": "closed"
    }
  ],
  "created_at": "2026-06-03T19:41:00Z",
  "updated_at": "2026-06-03T19:41:00Z"
}
