{
  "schema_version": "1.0.0",
  "record_type": "evidence_appraisal",
  "id": "evidence-appraisal-ssr-acceptable-scoring-uses-operational-augmentation-update-method-classification-r1",
  "name": "Method Classification review for Acceptable Use Operational Training Augmentation Update bundle",
  "candidate_bundle_id": "ssr-acceptable-scoring-uses-operational-augmentation-update-2026-06-03",
  "bundle_revision_number": 1,
  "appraisal_round": 1,
  "appraisal_lane": "method_classification",
  "appraiser_kind": "agent",
  "skill_name": "evidence-appraisal",
  "appraiser_id": "codex-agent",
  "status": "complete",
  "verdict": "accept",
  "blocking": false,
  "summary": "Accepted. The update preserves method distinctions across LLM-generated operational Writing responses, Qwen-generated formative communication-skills responses, GPT-generated classroom NGSS explanations, and mismatched real operational spoken responses used as constructed off-topic cases.",
  "appraised_change_ids": [
    "update-acceptable-scoring-uses-claim"
  ],
  "findings": [
    {
      "finding_id": "generation-type-differences-retained",
      "severity": "note",
      "category": "method_scope",
      "claim_or_issue": "The four added sources do not all use the same kind of synthetic response generation.",
      "why_it_matters": "Acceptable-use categories should not collapse LLM generation, data corruption, simulation, and mismatched real-response construction into one method claim.",
      "recommended_action": "Keep the staged source-specific labels and limitations rather than generalizing across generation methods.",
      "resolution_status": "closed",
      "applies_to_change_id": "update-acceptable-scoring-uses-claim"
    }
  ],
  "created_at": "2026-06-03T12:06:30Z",
  "updated_at": "2026-06-03T12:06:30Z"
}
