{
  "schema_version": "1.0.0",
  "record_type": "evidence_appraisal",
  "id": "evidence-appraisal-ssr-operational-practice-policy-update-applicability-boundary-r1",
  "name": "Applicability Boundary review for Operational Practice and Policy Boundary Update bundle",
  "candidate_bundle_id": "ssr-operational-practice-policy-update-2026-06-03",
  "bundle_revision_number": 1,
  "appraisal_round": 1,
  "appraisal_lane": "applicability_boundary",
  "appraiser_kind": "agent",
  "skill_name": "evidence-appraisal",
  "appraiser_id": "codex-agent",
  "status": "complete",
  "verdict": "accept",
  "blocking": false,
  "summary": "Accepted. The bundle distinguishes summative operational QA, summative governed training augmentation, and no-direct-consequence research augmentation. The claims preserve unknown contexts for additional state/vendor policies and high-stakes live scoring.",
  "appraised_change_ids": [
    "create-new-meridian-source",
    "create-new-meridian-artifact",
    "create-new-meridian-finding",
    "create-maine-source",
    "create-maine-artifact",
    "create-maine-finding",
    "create-zhang-source",
    "create-zhang-artifact",
    "create-zhang-finding",
    "create-operational-practice-search-protocol",
    "update-acceptable-scoring-uses-claim",
    "update-assessment-stakes-boundaries-claim"
  ],
  "findings": [
    {
      "finding_id": "stakes-boundary-kept-to-support-uses",
      "severity": "note",
      "category": "applicability_boundary",
      "claim_or_issue": "The updated stakes claim allows high-stakes support uses only as QA/test suites, governed training augmentation, or stress testing, with final validation excluded.",
      "why_it_matters": "Operational examples in summative programs should not become blanket permission for high-stakes score-use decisions.",
      "recommended_action": "Keep the staged applies_when, does_not_apply_when, and unknown_or_unreviewed_contexts language.",
      "resolution_status": "closed",
      "applies_to_change_id": "update-assessment-stakes-boundaries-claim"
    }
  ],
  "created_at": "2026-06-03T13:22:00Z",
  "updated_at": "2026-06-03T13:22:00Z"
}
