{
  "schema_version": "1.0.0",
  "record_type": "evidence_appraisal",
  "id": "evidence-appraisal-ssr-model-choice-student-simulation-validity-update-scorer-validation-relevance-r1",
  "name": "Scorer Validation Relevance review for Model Choice and Student-Simulation Validity Update bundle",
  "candidate_bundle_id": "ssr-model-choice-student-simulation-validity-update-2026-06-03",
  "bundle_revision_number": 1,
  "appraisal_round": 1,
  "appraisal_lane": "scorer_validation_relevance",
  "appraiser_kind": "agent",
  "skill_name": "evidence-appraisal",
  "appraiser_id": "codex-agent",
  "status": "complete",
  "verdict": "accept",
  "blocking": false,
  "summary": "Accepted with boundary. None of the three new sources validates an automated scorer or supports synthetic-only validation. Their relevance is to model-choice criteria, response realism, simulated-learner validity, and reporting controls.",
  "appraised_change_ids": [
    "create-do-source",
    "create-do-artifact",
    "create-do-finding",
    "create-yuan-source",
    "create-yuan-artifact",
    "create-yuan-finding",
    "create-martynova-source",
    "create-martynova-artifact",
    "create-martynova-finding",
    "create-model-choice-search-protocol"
  ],
  "findings": [
    {
      "finding_id": "model-choice-update-not-scorer-validation",
      "severity": "note",
      "category": "scorer_relevance_gap",
      "claim_or_issue": "The new findings are scorer-adjacent only through response-generation and simulation-quality conditions.",
      "why_it_matters": "The application memo should not convert student-simulation validity evidence into scorer-validity evidence.",
      "recommended_action": "Use the new records to refine model-choice and reporting criteria while preserving held-out real-response validation as the scorer evidence standard.",
      "resolution_status": "closed",
      "applies_to_change_id": "create-model-choice-search-protocol"
    }
  ],
  "created_at": "2026-06-03T20:17:00Z",
  "updated_at": "2026-06-03T20:17:00Z"
}
