{
  "schema_version": "1.0.0",
  "record_type": "evidence_appraisal",
  "id": "evidence-appraisal-ssr-operational-practice-policy-update-method-classification-r1",
  "name": "Method Classification review for Operational Practice and Policy Boundary Update bundle",
  "candidate_bundle_id": "ssr-operational-practice-policy-update-2026-06-03",
  "bundle_revision_number": 1,
  "appraisal_round": 1,
  "appraisal_lane": "method_classification",
  "appraiser_kind": "agent",
  "skill_name": "evidence-appraisal",
  "appraiser_id": "codex-agent",
  "status": "complete",
  "verdict": "accept",
  "blocking": false,
  "summary": "Accepted. New Meridian and Maine are classified as pre-pilot rule-based machine-scoring QA with no generation model reported. Zhang et al. is classified as GPT-4/GPT-4o training augmentation with held-out student-essay evaluation.",
  "appraised_change_ids": [
    "create-new-meridian-source",
    "create-new-meridian-artifact",
    "create-new-meridian-finding",
    "create-maine-source",
    "create-maine-artifact",
    "create-maine-finding",
    "create-zhang-source",
    "create-zhang-artifact",
    "create-zhang-finding",
    "create-operational-practice-search-protocol",
    "update-acceptable-scoring-uses-claim",
    "update-assessment-stakes-boundaries-claim"
  ],
  "findings": [
    {
      "finding_id": "method-classes-kept-source-specific",
      "severity": "note",
      "category": "method_classification",
      "claim_or_issue": "The bundle does not infer LLM generation for New Meridian or Maine and does not treat Zhang et al.'s GPT training augmentation as operational policy.",
      "why_it_matters": "The evidence only supports the methods actually reported in each source.",
      "recommended_action": "Keep the no-LLM classifications for operational QA sources and the research/development classification for Zhang et al.",
      "resolution_status": "closed",
      "applies_to_change_id": "create-zhang-artifact"
    }
  ],
  "created_at": "2026-06-03T13:22:00Z",
  "updated_at": "2026-06-03T13:22:00Z"
}
